{
  "contract_name": "parameter-contract.v1",
  "contract_version": 1,
  "registry_id": "negative-secret-default",
  "generated_at": "2026-07-16T18:00:00Z",
  "parameters": [
    {
      "key": "SOURCE_EXPORT_CREDENTIAL_REF",
      "value_type": "secret_reference",
      "description": "A reference that must never have a committed default.",
      "resolver": {
        "source": "secret_store",
        "input": "SOURCE_EXPORT_CREDENTIAL_REF",
        "required": false
      },
      "freshness": {"mode": "live"},
      "validation": {"pattern": "^(env|keychain|vault|connector):"},
      "secret_reference_policy": "reference_only",
      "default": "plaintext-secret",
      "example_placeholder": "${SOURCE_EXPORT_CREDENTIAL_REF}"
    }
  ]
}
